[
  {"schema_version":"2.0.0","record_type":"source_record","source_id":"source-shelter-r4","publisher":{"id":"publisher-r4-emergency","name":"Region 4 Emergency Office"},"steward":{"identity":"urn:synthetic:steward:r4","role":"Emergency information steward"},"authority_class":"official","locator":{"kind":"file","reference":"evidence/shelter-r4.txt","acquisition_method":"manual_upload","connector_id":"synthetic-drill-intake","acquisition_policy_version":"1.0"},"acquired_at":"2026-10-06T16:00:00Z","last_verified_at":"2026-10-06T17:30:00Z","evidence":{"media_type":"text/plain","byte_size":46,"digest":"sha256:66a839afee3abe5a75c084e66fb226226e8f77c0760c8e8644591361bd74e191"},"rights":{"license":"Synthetic drill data","redistribution":"permitted","restrictions":[]},"scope":{"geographies":["region-4/zone-north"],"languages":["en","es"],"audiences":["public"],"subjects":["shelter-status"]},"freshness":{"effective_from":"2026-10-06T16:00:00Z","valid_until":"2026-10-07T00:00:00Z","expected_refresh_seconds":1800,"stale_action":"block"},"sensitivity":"public","distribution":"public"},
  {"schema_version":"2.0.0","record_type":"source_record","source_id":"source-water-r4","publisher":{"id":"publisher-r4-water","name":"Region 4 Water Utility"},"steward":{"identity":"urn:synthetic:steward:water","role":"Water safety information steward"},"authority_class":"official","locator":{"kind":"file","reference":"evidence/water-r4.txt","acquisition_method":"manual_upload","connector_id":"synthetic-drill-intake","acquisition_policy_version":"1.0"},"acquired_at":"2026-10-06T16:10:00Z","last_verified_at":"2026-10-06T17:30:00Z","evidence":{"media_type":"text/plain","byte_size":58,"digest":"sha256:72ed2c9213e37525417325ebde3aa13dd4bed006f41fcd35b7da7aeb0207bb7e"},"rights":{"license":"Synthetic drill data","redistribution":"permitted","restrictions":[]},"scope":{"geographies":["region-4/zone-north"],"languages":["en","es"],"audiences":["public"],"subjects":["water-safety"]},"freshness":{"effective_from":"2026-10-06T16:10:00Z","valid_until":"2026-10-07T00:00:00Z","expected_refresh_seconds":1800,"stale_action":"block"},"sensitivity":"public","distribution":"public"},
  {"schema_version":"2.0.0","record_type":"source_record","source_id":"source-evacuation-old","publisher":{"id":"publisher-r4-emergency","name":"Region 4 Emergency Office"},"steward":{"identity":"urn:synthetic:steward:r4","role":"Emergency information steward"},"authority_class":"official","locator":{"kind":"file","reference":"evidence/evacuation-old.txt","acquisition_method":"manual_upload","connector_id":"synthetic-drill-intake","acquisition_policy_version":"1.0"},"acquired_at":"2026-10-06T12:00:00Z","last_verified_at":"2026-10-06T12:00:00Z","evidence":{"media_type":"text/plain","byte_size":40,"digest":"sha256:e14031f9729d7df792c1253fd13f0b101f2d187e816b26aec464528e5aacdf86"},"rights":{"license":"Synthetic drill data","redistribution":"permitted","restrictions":[]},"scope":{"geographies":["region-4/zone-north"],"languages":["en"],"audiences":["public"],"subjects":["evacuation-route"]},"freshness":{"effective_from":"2026-10-06T12:00:00Z","valid_until":"2026-10-06T17:00:00Z","expected_refresh_seconds":1800,"stale_action":"block"},"sensitivity":"public","distribution":"public"},
  {"schema_version":"2.0.0","record_type":"source_record","source_id":"source-evacuation-correction","publisher":{"id":"publisher-r4-emergency","name":"Region 4 Emergency Office"},"steward":{"identity":"urn:synthetic:steward:r4","role":"Emergency information steward"},"authority_class":"official","locator":{"kind":"file","reference":"evidence/evacuation-correction.txt","acquisition_method":"manual_upload","connector_id":"synthetic-drill-intake","acquisition_policy_version":"1.0"},"acquired_at":"2026-10-06T17:00:00Z","last_verified_at":"2026-10-06T17:30:00Z","evidence":{"media_type":"text/plain","byte_size":70,"digest":"sha256:a42cded32b2404fd7da8ae255c365d1ad653797c1a3563e2aad8bc830611a207"},"rights":{"license":"Synthetic drill data","redistribution":"permitted","restrictions":[]},"scope":{"geographies":["region-4/zone-north"],"languages":["en"],"audiences":["public"],"subjects":["evacuation-route"]},"freshness":{"effective_from":"2026-10-06T17:00:00Z","valid_until":"2026-10-07T00:00:00Z","expected_refresh_seconds":1800,"stale_action":"block"},"sensitivity":"public","distribution":"public"},
  {"schema_version":"2.0.0","record_type":"source_record","source_id":"source-shelter-r5","publisher":{"id":"publisher-r5-emergency","name":"Region 5 Emergency Office"},"steward":{"identity":"urn:synthetic:steward:r5","role":"Emergency information steward"},"authority_class":"official","locator":{"kind":"file","reference":"evidence/shelter-r5.txt","acquisition_method":"manual_upload","connector_id":"synthetic-drill-intake","acquisition_policy_version":"1.0"},"acquired_at":"2026-10-06T16:05:00Z","last_verified_at":"2026-10-06T17:30:00Z","evidence":{"media_type":"text/plain","byte_size":64,"digest":"sha256:5eb61d25ddec0b99962e228d2d2e1618957f62cefd755da88ecb56122c0263a5"},"rights":{"license":"Synthetic drill data","redistribution":"permitted","restrictions":[]},"scope":{"geographies":["region-5/zone-north"],"languages":["en"],"audiences":["public"],"subjects":["shelter-status"]},"freshness":{"effective_from":"2026-10-06T16:05:00Z","valid_until":"2026-10-07T00:00:00Z","expected_refresh_seconds":1800,"stale_action":"block"},"sensitivity":"public","distribution":"public"}
]
